{
  "handoff_metadata": {
    "agent_id": "Claude Sonnet 4 - kOS CI/CD Verification Specialist",
    "timestamp": "2025-07-10T23:45:00Z",
    "version": "1.0.0",
    "status": "FINAL",
    "priority": "high",
    "estimated_completion_time": "2-3 hours",
    "context_window_status": "full"
  },
  "execution_summary": {
    "completed_work": [
      "Verified CI/CD pipeline structure (.github/workflows/ci.yml, pr.yml, sync-to-gitea.yml)",
      "Confirmed issue templates and PR template presence",
      "Validated pre-commit hooks setup (.husky/pre-commit)",
      "Verified all documentation is in JSON format (no stray Markdown)",
      "Validated centralized config files (config/centralized_config.json, centralized_ports.json)",
      "Confirmed environment variable management structure (env/ directory)",
      "Validated JSON documentation files are properly formatted",
      "Set up portable Node.js environment for local testing",
      "Identified missing dependencies in node_modules"
    ],
    "work_in_progress": [
      "Complete dependency installation for full CI/CD testing",
      "Final verification of all npm scripts (test, lint, build, type-check)"
    ],
    "blocked_items": [
      "Jest testing framework not found in node_modules/.bin",
      "Next.js build process requires complete dependency installation",
      "Some npm scripts may need dependency resolution"
    ]
  },
  "critical_context": {
    "project_state": {
      "current_phase": "CI/CD and Core Development Systems Setup",
      "documentation_system_state": "JSON-only documentation complete, all standards in place",
      "recipe_library_state": "Blueprint system with templates and standards available",
      "automation_state": "GitHub Actions workflows configured, pre-commit hooks active"
    },
    "key_decisions": [
      "All documentation must be JSON format (except README.md for humans)",
      "Portable Node.js setup required for consistent development environment",
      "Zero technical debt policies enforced through pre-commit hooks",
      "Centralized configuration management through config/ and env/ directories"
    ],
    "technical_debt": [
      "Incomplete node_modules installation - missing Jest and other testing tools",
      "Build process dependencies need resolution",
      "Some npm scripts may not work without full dependency installation"
    ],
    "performance_notes": [
      "Portable Node.js setup provides consistent environment across systems",
      "Pre-commit hooks will catch code quality issues early",
      "Centralized config reduces environment-specific issues"
    ]
  },
  "immediate_actions_required": {
    "phase_1": {
      "duration": "30 minutes",
      "tasks": [
        {
          "task": "Complete dependency installation",
          "description": "Run 'npm install' to install all missing dependencies including Jest, Next.js, and other testing tools",
          "location": "Project root",
          "template": "Use portable Node.js: nodejs-portable/node-v20.11.0-win-x64/npm.cmd install"
        },
        {
          "task": "Verify Jest installation",
          "description": "Confirm Jest is available in node_modules/.bin for running tests",
          "location": "node_modules/.bin",
          "template": "Check for jest.cmd and jest files"
        }
      ]
    },
    "phase_2": {
      "duration": "1 hour",
      "tasks": [
        {
          "task": "Run complete CI/CD verification",
          "description": "Execute all npm scripts: test, lint, type-check, build to verify pipeline works",
          "location": "Project root",
          "template": "Use portable Node.js for all commands"
        },
        {
          "task": "Validate GitHub Actions locally",
          "description": "Test that all CI workflow steps can run successfully",
          "location": ".github/workflows/",
          "template": "Verify YAML syntax and script availability"
        }
      ]
    },
    "phase_3": {
      "duration": "1 hour",
      "tasks": [
        {
          "task": "Patch any issues found",
          "description": "Fix any failing tests, lint errors, or build issues",
          "location": "As needed",
          "template": "Follow zero technical debt policies"
        },
        {
          "task": "Update handoff documentation",
          "description": "Document all findings and fixes in JSON format",
          "location": "agents/LATEST/",
          "template": "Use handoff_template.json structure"
        }
      ]
    }
  },
  "quality_standards": {
    "documentation_standards": [
      "All documentation in JSON format (except README.md)",
      "Follow blueprint template structure",
      "Include timestamps and version information",
      "Reference related files and dependencies"
    ],
    "recipe_standards": [
      "Atomic design - each file â‰¤ 300 lines",
      "Deterministic execution",
      "Vault-safe (no hardcoded secrets)",
      "Registry-validated"
    ],
    "agent_standards": [
      "Use portable Node.js for consistent environment",
      "Follow zero technical debt policies",
      "Document all changes in JSON handoff files",
      "Test all changes before committing"
    ]
  },
  "file_locations": {
    "critical_files": {
      "ci_workflow": ".github/workflows/ci.yml",
      "pr_workflow": ".github/workflows/pr.yml",
      "pre_commit_hooks": ".husky/pre-commit",
      "package_scripts": "package.json",
      "portable_nodejs": "nodejs-portable/node-v20.11.0-win-x64/"
    },
    "recipe_library": {
      "blueprint_templates": "agents/blueprint/TEMPLATES/",
      "standards": "agents/blueprint/standards/",
      "kitchen_system": "agents/blueprint/kitchen/"
    },
    "documentation": {
      "contributing": "docs/contributing.json",
      "development_standards": "docs/development-standards.json",
      "code_quality": "docs/code-quality-guidelines.json",
      "config": "config/centralized_config.json"
    }
  },
  "success_criteria": {
    "immediate": [
      "All npm scripts (test, lint, type-check, build) run successfully",
      "GitHub Actions workflows validate without errors",
      "Pre-commit hooks work correctly",
      "All dependencies properly installed"
    ],
    "long_term": [
      "CI/CD pipeline provides reliable quality gates",
      "Development environment is consistent across all developers",
      "Zero technical debt maintained",
      "All documentation stays in JSON format"
    ]
  },
  "next_agent_instructions": {
    "immediate_start": [
      "1. Run 'nodejs-portable/node-v20.11.0-win-x64/npm.cmd install' to complete dependency installation",
      "2. Verify Jest is available: 'dir node_modules\\.bin\\jest*'",
      "3. Run tests: 'nodejs-portable/node-v20.11.0-win-x64/npm.cmd test'",
      "4. Run lint: 'nodejs-portable/node-v20.11.0-win-x64/npm.cmd run lint'",
      "5. Run build: 'nodejs-portable/node-v20.11.0-win-x64/npm.cmd run build'"
    ],
    "critical_reminders": [
      "Use portable Node.js for all npm commands",
      "All documentation must be JSON (except README.md)",
      "Follow zero technical debt policies",
      "Document all changes in handoff files",
      "Test everything before committing"
    ],
    "handoff_completion": [
      "Update this handoff file with final results",
      "Create summary of any issues found and fixes applied",
      "Ensure next agent has clear path forward",
      "Commit all changes with detailed messages"
    ]
  },
  "risk_mitigation": {
    "technical_risks": [
      "Incomplete dependency installation may cause build failures",
      "Missing testing tools could break CI pipeline",
      "Portable Node.js setup requires consistent usage"
    ],
    "timeline_risks": [
      "Dependency resolution may take longer than expected",
      "Test failures may require significant debugging time",
      "Build issues could delay CI/CD completion"
    ],
    "quality_risks": [
      "Rushing dependency installation could introduce new issues",
      "Skipping tests could allow regressions",
      "Not following standards could create technical debt"
    ]
  }
} 